[INFO] Scanning for projects...
[INFO] 
[INFO] -------------------------< com.mdoner:backend >-------------------------
[INFO] Building mdoner-backend 0.0.1-SNAPSHOT
[INFO]   from pom.xml
[INFO] --------------------------------[ jar ]---------------------------------
[INFO] 
[INFO] --- resources:3.3.1:resources (default-resources) @ backend ---
[INFO] Copying 1 resource from src\main\resources to target\classes
[INFO] Copying 0 resource from src\main\resources to target\classes
[INFO] 
[INFO] --- compiler:3.11.0:compile (default-compile) @ backend ---
[INFO] Nothing to compile - all classes are up to date
[INFO] 
[INFO] --- resources:3.3.1:testResources (default-testResources) @ backend ---
[INFO] skip non existing resourceDirectory C:\Users\Sahil\Downloads\mdoner-ai-dpr-evaluator\backend\src\test\resources
[INFO] 
[INFO] --- compiler:3.11.0:testCompile (default-testCompile) @ backend ---
[INFO] Nothing to compile - all classes are up to date
[INFO] 
[INFO] --- surefire:3.1.2:test (default-test) @ backend ---
[INFO] Using auto detected provider org.apache.maven.surefire.junitplatform.JUnitPlatformProvider
[INFO] 
[INFO] -------------------------------------------------------
[INFO]  T E S T S
[INFO] -------------------------------------------------------
[INFO] Running com.mdoner.backend.service.DprProcessingServiceTest
Java HotSpot(TM) 64-Bit Server VM warning: Sharing is only supported for boot loader classes because bootstrap classpath has been appended
WARNING: A Java agent has been loaded dynamically (C:\Users\Sahil\.m2\repository\net\bytebuddy\byte-buddy-agent\1.14.11\byte-buddy-agent-1.14.11.jar)
WARNING: If a serviceability tool is in use, please run with -XX:+EnableDynamicAgentLoading to hide this warning
WARNING: If a serviceability tool is not in use, please run with -Djdk.instrument.traceUsage for more information
WARNING: Dynamic loading of agents will be disallowed by default in a future release
[ERROR] Tests run: 1, Failures: 0, Errors: 1, Skipped: 0, Time elapsed: 0.781 s <<< FAILURE! -- in com.mdoner.backend.service.DprProcessingServiceTest
[ERROR] com.mdoner.backend.service.DprProcessingServiceTest.testProcessAsync_Success -- Time elapsed: 0.739 s <<< ERROR!
org.mockito.exceptions.base.MockitoException: 

Mockito cannot mock this class: class com.mdoner.backend.service.PdfExtractionService.

If you're not sure why you're getting this error, please open an issue on GitHub.


Java               : 24
JVM vendor name    : Oracle Corporation
JVM vendor version : 24.0.2+12-54
JVM name           : Java HotSpot(TM) 64-Bit Server VM
JVM version        : 24.0.2+12-54
JVM info           : mixed mode, sharing
OS name            : Windows 11
OS version         : 10.0


You are seeing this disclaimer because Mockito is configured to create inlined mocks.
You can learn about inline mocks and their limitations under item #39 of the Mockito class javadoc.

Underlying exception : org.mockito.exceptions.base.MockitoException: Could not modify all classes [class com.mdoner.backend.service.PdfExtractionService, class java.lang.Object]
	at org.mockito.junit.jupiter.MockitoExtension.beforeEach(MockitoExtension.java:159)
	at java.base/java.util.ArrayList.forEach(ArrayList.java:1604)
	at java.base/java.util.ArrayList.forEach(ArrayList.java:1604)
	Suppressed: java.lang.NullPointerException: Cannot invoke "java.util.Set.forEach(java.util.function.Consumer)" because the return value of "org.junit.jupiter.api.extension.ExtensionContext$Store.remove(Object, java.lang.Class)" is null
		at org.mockito.junit.jupiter.MockitoExtension.afterEach(MockitoExtension.java:190)
		... 2 more
Caused by: org.mockito.exceptions.base.MockitoException: Could not modify all classes [class com.mdoner.backend.service.PdfExtractionService, class java.lang.Object]
	at net.bytebuddy.TypeCache.findOrInsert(TypeCache.java:168)
	at net.bytebuddy.TypeCache$WithInlineExpunction.findOrInsert(TypeCache.java:399)
	at net.bytebuddy.TypeCache.findOrInsert(TypeCache.java:190)
	at net.bytebuddy.TypeCache$WithInlineExpunction.findOrInsert(TypeCache.java:410)
	... 3 more
Caused by: java.lang.IllegalStateException: 
Byte Buddy could not instrument all classes within the mock's type hierarchy

This problem should never occur for javac-compiled classes. This problem has been observed for classes that are:
 - Compiled by older versions of scalac
 - Classes that are part of the Android distribution
	at org.mockito.internal.creation.bytebuddy.InlineBytecodeGenerator.triggerRetransformation(InlineBytecodeGenerator.java:285)
	at org.mockito.internal.creation.bytebuddy.InlineBytecodeGenerator.mockClass(InlineBytecodeGenerator.java:218)
	at org.mockito.internal.creation.bytebuddy.TypeCachingBytecodeGenerator.lambda$mockClass$0(TypeCachingBytecodeGenerator.java:78)
	at net.bytebuddy.TypeCache.findOrInsert(TypeCache.java:168)
	at net.bytebuddy.TypeCache$WithInlineExpunction.findOrInsert(TypeCache.java:399)
	at net.bytebuddy.TypeCache.findOrInsert(TypeCache.java:190)
	at net.bytebuddy.TypeCache$WithInlineExpunction.findOrInsert(TypeCache.java:410)
	at org.mockito.internal.creation.bytebuddy.TypeCachingBytecodeGenerator.mockClass(TypeCachingBytecodeGenerator.java:75)
	at org.mockito.internal.creation.bytebuddy.InlineDelegateByteBuddyMockMaker.createMockType(InlineDelegateByteBuddyMockMaker.java:412)
	at org.mockito.internal.creation.bytebuddy.InlineDelegateByteBuddyMockMaker.doCreateMock(InlineDelegateByteBuddyMockMaker.java:371)
	at org.mockito.internal.creation.bytebuddy.InlineDelegateByteBuddyMockMaker.createMock(InlineDelegateByteBuddyMockMaker.java:350)
	at org.mockito.internal.creation.bytebuddy.InlineByteBuddyMockMaker.createMock(InlineByteBuddyMockMaker.java:56)
	at org.mockito.internal.util.MockUtil.createMock(MockUtil.java:99)
	at org.mockito.internal.MockitoCore.mock(MockitoCore.java:88)
	at org.mockito.Mockito.mock(Mockito.java:2101)
	at org.mockito.internal.configuration.MockAnnotationProcessor.processAnnotationForMock(MockAnnotationProcessor.java:79)
	at org.mockito.internal.configuration.MockAnnotationProcessor.process(MockAnnotationProcessor.java:28)
	at org.mockito.internal.configuration.MockAnnotationProcessor.process(MockAnnotationProcessor.java:25)
	at org.mockito.internal.configuration.IndependentAnnotationEngine.createMockFor(IndependentAnnotationEngine.java:44)
	at org.mockito.internal.configuration.IndependentAnnotationEngine.process(IndependentAnnotationEngine.java:72)
	at org.mockito.internal.configuration.InjectingAnnotationEngine.processIndependentAnnotations(InjectingAnnotationEngine.java:62)
	at org.mockito.internal.configuration.InjectingAnnotationEngine.process(InjectingAnnotationEngine.java:47)
	at org.mockito.MockitoAnnotations.openMocks(MockitoAnnotations.java:81)
	at org.mockito.internal.framework.DefaultMockitoSession.<init>(DefaultMockitoSession.java:43)
	at org.mockito.internal.session.DefaultMockitoSessionBuilder.startMocking(DefaultMockitoSessionBuilder.java:83)
	... 3 more
Caused by: java.lang.IllegalArgumentException: Java 24 (68) is not supported by the current version of Byte Buddy which officially supports Java 22 (66) - update Byte Buddy or set net.bytebuddy.experimental as a VM property
	at net.bytebuddy.utility.OpenedClassReader.of(OpenedClassReader.java:100)
	at net.bytebuddy.dynamic.scaffold.TypeWriter$Default$ForInlining.create(TypeWriter.java:4011)
	at net.bytebuddy.dynamic.scaffold.TypeWriter$Default.make(TypeWriter.java:2224)
	at net.bytebuddy.dynamic.DynamicType$Builder$AbstractBase$UsingTypeWriter.make(DynamicType.java:4055)
	at net.bytebuddy.dynamic.DynamicType$Builder$AbstractBase.make(DynamicType.java:3739)
	at org.mockito.internal.creation.bytebuddy.InlineBytecodeGenerator.transform(InlineBytecodeGenerator.java:402)
	at java.instrument/java.lang.instrument.ClassFileTransformer.transform(ClassFileTransformer.java:257)
	at java.instrument/sun.instrument.TransformerManager.transform(TransformerManager.java:188)
	at java.instrument/sun.instrument.InstrumentationImpl.transform(InstrumentationImpl.java:594)
	at java.instrument/sun.instrument.InstrumentationImpl.retransformClasses0(Native Method)
	at java.instrument/sun.instrument.InstrumentationImpl.retransformClasses(InstrumentationImpl.java:221)
	at org.mockito.internal.creation.bytebuddy.InlineBytecodeGenerator.triggerRetransformation(InlineBytecodeGenerator.java:281)
	... 27 more

[INFO] 
[INFO] Results:
[INFO] 
[ERROR] Errors: 
[ERROR]   DprProcessingServiceTest.testProcessAsync_Success » Mockito 
Mockito cannot mock this class: class com.mdoner.backend.service.PdfExtractionService.

If you're not sure why you're getting this error, please open an issue on GitHub.


Java               : 24
JVM vendor name    : Oracle Corporation
JVM vendor version : 24.0.2+12-54
JVM name           : Java HotSpot(TM) 64-Bit Server VM
JVM version        : 24.0.2+12-54
JVM info           : mixed mode, sharing
OS name            : Windows 11
OS version         : 10.0


You are seeing this disclaimer because Mockito is configured to create inlined mocks.
You can learn about inline mocks and their limitations under item #39 of the Mockito class javadoc.

Underlying exception : org.mockito.exceptions.base.MockitoException: Could not modify all classes [class com.mdoner.backend.service.PdfExtractionService, class java.lang.Object]
[INFO] 
[ERROR] Tests run: 1, Failures: 0, Errors: 1, Skipped: 0
[INFO] 
[INFO] ------------------------------------------------------------------------
[INFO] BUILD FAILURE
[INFO] ------------------------------------------------------------------------
[INFO] Total time:  2.883 s
[INFO] Finished at: 2026-01-08T23:08:06+05:30
[INFO] ------------------------------------------------------------------------
[ERROR] Failed to execute goal org.apache.maven.plugins:maven-surefire-plugin:3.1.2:test (default-test) on project backend: 
[ERROR] 
[ERROR] Please refer to C:\Users\Sahil\Downloads\mdoner-ai-dpr-evaluator\backend\target\surefire-reports for the individual test results.
[ERROR] Please refer to dump files (if any exist) [date].dump, [date]-jvmRun[N].dump and [date].dumpstream.
[ERROR] -> [Help 1]
[ERROR] 
[ERROR] To see the full stack trace of the errors, re-run Maven with the -e switch.
[ERROR] Re-run Maven using the -X switch to enable full debug logging.
[ERROR] 
[ERROR] For more information about the errors and possible solutions, please read the following articles:
[ERROR] [Help 1] http://cwiki.apache.org/confluence/display/MAVEN/MojoFailureException
